python/collage/demo/autotvm_tuning_log_bert_full_rtx3070.json
{"input": ["cuda -keys=cuda,gpu -arch=sm_86 -max_num_threads=1024 -max_threads_per_block=1024 -registers_per_block=65536 -shared_memory_per_block=49152 -thread_warp_size=32", "dense_large_batch.gpu", [["TENSOR", [64, 1024], "float32"], ["TENSOR", [256, 1024], "float32"], null, "float32"], {}], "config": {"index": 624659, "code_hash": null, "entity": [["tile_x", "sp", [-1, 2, 2, 2]], ["tile_y", "sp", [-1, 4, 2, 1]], ["tile_k", "sp", [-1, 1, 32]]]}, "result": [[6.461886532797858e-05], 0, 2.2681496143341064, 1643851910.1289945], "version": 0.2, "tvm_version": "0.9.dev0"}
{"input": ["cuda -keys=cuda,gpu -arch=sm_86 -max_num_threads=1024 -max_threads_per_block=1024 -registers_per_block=65536 -shared_memory_per_block=49152 -thread_warp_size=32", "dense_small_batch.gpu", [["TENSOR", [64, 1024], "float32"], ["TENSOR", [256, 1024], "float32"], null, "float32"], {}], "config": {"index": 5, "code_hash": null, "entity": [["tile_k", "sp", [-1, 32]]]}, "result": [[4.447210938871015e-05], 0, 0.9132368564605713, 1643852934.0800877], "version": 0.2, "tvm_version": "0.9.dev0"}
{"input": ["cuda -keys=cuda,gpu -arch=sm_86 -max_num_threads=1024 -max_threads_per_block=1024 -registers_per_block=65536 -shared_memory_per_block=49152 -thread_warp_size=32", "dense_large_batch.gpu", [["TENSOR", [64, 256], "float32"], ["TENSOR", [1024, 256], "float32"], null, "float32"], {}], "config": {"index": 722668, "code_hash": null, "entity": [["tile_x", "sp", [-1, 8, 4, 1]], ["tile_y", "sp", [-1, 4, 4, 1]], ["tile_k", "sp", [-1, 1, 16]]]}, "result": [[1.5152237842673653e-05], 0, 1.854816198348999, 1643854324.562123], "version": 0.2, "tvm_version": "0.9.dev0"}
{"input": ["cuda -keys=cuda,gpu -arch=sm_86 -max_num_threads=1024 -max_threads_per_block=1024 -registers_per_block=65536 -shared_memory_per_block=49152 -thread_warp_size=32", "dense_small_batch.gpu", [["TENSOR", [64, 256], "float32"], ["TENSOR", [1024, 256], "float32"], null, "float32"], {}], "config": {"index": 5, "code_hash": null, "entity": [["tile_k", "sp", [-1, 32]]]}, "result": [[6.920584187911773e-05], 0, 1.305295467376709, 1643855519.4819043], "version": 0.2, "tvm_version": "0.9.dev0"}
{"input": ["cuda -keys=cuda,gpu -arch=sm_86 -max_num_threads=1024 -max_threads_per_block=1024 -registers_per_block=65536 -shared_memory_per_block=49152 -thread_warp_size=32", "batch_matmul.cuda", [["TENSOR", [8, 64, 64], "float32"], ["TENSOR", [8, 32, 64], "float32"], [8, 64, 32], "float32", 0, 1], {}], "config": {"index": 6598, "code_hash": null, "entity": [["tile_y", "sp", [-1, 1, 8]], ["tile_x", "sp", [-1, 16, 1]], ["tile_k", "sp", [-1, 16]], ["auto_unroll_max_step", "ot", 16], ["unroll_explicit", "ot", 0]]}, "result": [[2.935783322899371e-06], 0, 1.530799388885498, 1643855926.5894887], "version": 0.2, "tvm_version": "0.9.dev0"}
{"input": ["cuda -keys=cuda,gpu -arch=sm_86 -max_num_threads=1024 -max_threads_per_block=1024 -registers_per_block=65536 -shared_memory_per_block=49152 -thread_warp_size=32", "batch_matmul.cuda", [["TENSOR", [8, 64, 32], "float32"], ["TENSOR", [8, 64, 32], "float32"], [8, 64, 64], "float32", 0, 1], {}], "config": {"index": 36195, "code_hash": null, "entity": [["tile_y", "sp", [-1, 2, 8]], ["tile_x", "sp", [-1, 16, 1]], ["tile_k", "sp", [-1, 16]], ["auto_unroll_max_step", "ot", 64], ["unroll_explicit", "ot", 1]]}, "result": [[2.5303175763752284e-06], 0, 1.5305352210998535, 1643856729.9534354], "version": 0.2, "tvm_version": "0.9.dev0"}
{"input": ["cuda -keys=cuda,gpu -arch=sm_86 -max_num_threads=1024 -max_threads_per_block=1024 -registers_per_block=65536 -shared_memory_per_block=49152 -thread_warp_size=32", "dense_large_batch.gpu", [["TENSOR", [64, 256], "float32"], ["TENSOR", [256, 256], "float32"], null, "float32"], {}], "config": {"index": 167930, "code_hash": null, "entity": [["tile_x", "sp", [-1, 2, 4, 1]], ["tile_y", "sp", [-1, 4, 4, 1]], ["tile_k", "sp", [-1, 8, 2]]]}, "result": [[8.245797737267698e-06], 0, 1.892632246017456, 1643858286.8115861], "version": 0.2, "tvm_version": "0.9.dev0"}
{"input": ["cuda -keys=cuda,gpu -arch=sm_86 -max_num_threads=1024 -max_threads_per_block=1024 -registers_per_block=65536 -shared_memory_per_block=49152 -thread_warp_size=32", "dense_small_batch.gpu", [["TENSOR", [64, 256], "float32"], ["TENSOR", [256, 256], "float32"], null, "float32"], {}], "config": {"index": 5, "code_hash": null, "entity": [["tile_k", "sp", [-1, 32]]]}, "result": [[1.8448482607018896e-05], 0, 1.2654438018798828, 1643859234.6946723], "version": 0.2, "tvm_version": "0.9.dev0"}
