python/collage/demo/autotvm_tuning_log_bert_rtx3070.json
{"input": ["cuda -keys=cuda,gpu -arch=sm_86 -max_num_threads=1024 -max_threads_per_block=1024 -registers_per_block=65536 -shared_memory_per_block=49152 -thread_warp_size=32", "dense_large_batch.gpu", [["TENSOR", [64, 4096], "float32"], ["TENSOR", [1024, 4096], "float32"], null, "float32"], {}], "config": {"index": 126643, "code_hash": null, "entity": [["tile_x", "sp", [-1, 2, 2, 4]], ["tile_y", "sp", [-1, 2, 2, 2]], ["tile_k", "sp", [-1, 32, 1]]]}, "result": [[0.0006675989015384615], 0, 3.3174264430999756, 1643928812.2942007], "version": 0.2, "tvm_version": "0.9.dev0"}
{"input": ["cuda -keys=cuda,gpu -arch=sm_86 -max_num_threads=1024 -max_threads_per_block=1024 -registers_per_block=65536 -shared_memory_per_block=49152 -thread_warp_size=32", "dense_small_batch.gpu", [["TENSOR", [64, 4096], "float32"], ["TENSOR", [1024, 4096], "float32"], null, "float32"], {}], "config": {"index": 9, "code_hash": null, "entity": [["tile_k", "sp", [-1, 512]]]}, "result": [[0.002543994694915254], 0, 1.1717171669006348, 1643929427.3369956], "version": 0.2, "tvm_version": "0.9.dev0"}
{"input": ["cuda -keys=cuda,gpu -arch=sm_86 -max_num_threads=1024 -max_threads_per_block=1024 -registers_per_block=65536 -shared_memory_per_block=49152 -thread_warp_size=32", "dense_large_batch.gpu", [["TENSOR", [64, 1024], "float32"], ["TENSOR", [4096, 1024], "float32"], null, "float32"], {}], "config": {"index": 1187188, "code_hash": null, "entity": [["tile_x", "sp", [-1, 8, 4, 1]], ["tile_y", "sp", [-1, 8, 4, 1]], ["tile_k", "sp", [-1, 2, 8]]]}, "result": [[0.000151196206], 0, 2.4985947608947754, 1643931855.6246681], "version": 0.2, "tvm_version": "0.9.dev0"}
{"input": ["cuda -keys=cuda,gpu -arch=sm_86 -max_num_threads=1024 -max_threads_per_block=1024 -registers_per_block=65536 -shared_memory_per_block=49152 -thread_warp_size=32", "dense_small_batch.gpu", [["TENSOR", [64, 1024], "float32"], ["TENSOR", [4096, 1024], "float32"], null, "float32"], {}], "config": {"index": 8, "code_hash": null, "entity": [["tile_k", "sp", [-1, 256]]]}, "result": [[0.0025472878983050845], 0, 1.1638734340667725, 1643933090.5688016], "version": 0.2, "tvm_version": "0.9.dev0"}
{"input": ["cuda -keys=cuda,gpu -arch=sm_86 -max_num_threads=1024 -max_threads_per_block=1024 -registers_per_block=65536 -shared_memory_per_block=49152 -thread_warp_size=32", "batch_matmul.cuda", [["TENSOR", [16, 64, 64], "float32"], ["TENSOR", [16, 64, 64], "float32"], [16, 64, 64], "float32", 0, 1], {}], "config": {"index": 30708, "code_hash": null, "entity": [["tile_y", "sp", [-1, 4, 8]], ["tile_x", "sp", [-1, 16, 1]], ["tile_k", "sp", [-1, 16]], ["auto_unroll_max_step", "ot", 16], ["unroll_explicit", "ot", 1]]}, "result": [[4.293915430638118e-06], 0, 1.6114850044250488, 1643933318.088363], "version": 0.2, "tvm_version": "0.9.dev0"}
{"input": ["cuda -keys=cuda,gpu -arch=sm_86 -max_num_threads=1024 -max_threads_per_block=1024 -registers_per_block=65536 -shared_memory_per_block=49152 -thread_warp_size=32", "dense_large_batch.gpu", [["TENSOR", [64, 1024], "float32"], ["TENSOR", [1024, 1024], "float32"], null, "float32"], {}], "config": {"index": 98043, "code_hash": null, "entity": [["tile_x", "sp", [-1, 4, 4, 1]], ["tile_y", "sp", [-1, 4, 4, 1]], ["tile_k", "sp", [-1, 16, 1]]]}, "result": [[5.9336951379404526e-05], 0, 2.3090384006500244, 1643934666.7195375], "version": 0.2, "tvm_version": "0.9.dev0"}
{"input": ["cuda -keys=cuda,gpu -arch=sm_86 -max_num_threads=1024 -max_threads_per_block=1024 -registers_per_block=65536 -shared_memory_per_block=49152 -thread_warp_size=32", "dense_small_batch.gpu", [["TENSOR", [64, 1024], "float32"], ["TENSOR", [1024, 1024], "float32"], null, "float32"], {}], "config": {"index": 5, "code_hash": null, "entity": [["tile_k", "sp", [-1, 32]]]}, "result": [[0.00016276365484880085], 0, 1.1032989025115967, 1643935715.8241477], "version": 0.2, "tvm_version": "0.9.dev0"}
